{
  "$schema": "https://raw.githubusercontent.com/opensoft/oh-my-opencode/dev/assets/oh-my-opencode.schema.json",
  "globalFallbackModel": "MiniMax-M2.7-highspeed",
  "git_master": {
    "commit_footer": false,
    "include_co_authored_by": false
  },
  "agents": {
    "oracle": {
      "color": "#048B5E",
      "model": "oracle/gpt-5.5",
      "fallback_models": [
        "oracle/glm-5.1",
        "oracle/qwen3.5-plus",
        "oracle/kimi-k2.6",
        "oracle/MiniMax-M2.7-highspeed"
      ],
      "description": "Analista estratégico — avalia cenários, pondera trade-offs e produz recomendações fundamentadas para decisões de arquitetura e design."
    },
    "hephaestus": {
      "color": "#850047",
      "disable": false,
      "tools": {},
      "mode": "subagent",
      "model": "hephaestus/gpt-5.5",
      "fallback_models": [
        "hephaestus/deepseek-v4-pro",
        "hephaestus/glm-5.1",
        "hephaestus/MiniMax-M2.7-highspeed",
        "hephaestus/MiniMax-M2.7-highspeed"
      ],
      "description": "Engenheiro de implementação — escreve, refatora e depura código seguindo especificações precisas; opera como subagente especializado."
    },
    "atlas": {
      "color": "#AD7F00",
      "disable": false,
      "tools": {},
      "mode": "subagent",
      "model": "atlas/gpt-5.5",
      "fallback_models": [
        "atlas/mimo-v2.5-pro",
        "atlas/deepseek-v4-pro",
        "atlas/glm-5.1",
        "atlas/MiniMax-M2.7-highspeed"
      ],
      "description": "Consolidador de contexto amplo — agrega resultados de múltiplas frentes de trabalho e mantém coerência em tarefas que exigem visão sistêmica."
    },
    "sisyphus-junior": {
      "color": "#5A00C7",
      "model": "sisyphus-junior/gpt-5.5",
      "fallback_models": [
        "sisyphus-junior/MiniMax-M2.7-highspeed",
        "sisyphus-junior/qwen3.5-plus",
        "sisyphus-junior/glm-5.1:ollama",
        "sisyphus-junior/MiniMax-M2.7-highspeed"
      ],
      "description": "Executor leve — versão otimizada do Sisyphus para tarefas rápidas, mudanças localizadas e iterações de baixo custo."
    },
    "librarian": {
      "color": "#945E00",
      "model": "librarian/gpt-5.5",
      "fallback_models": [
        "librarian/qwen3.5-plus",
        "librarian/deepseek-v4-flash",
        "librarian/kimi-k2.6",
        "librarian/MiniMax-M2.7-highspeed"
      ],
      "description": "Curador de conhecimento — organiza documentação, referências técnicas e mantém a base de conhecimento do projeto."
    },
    "momus": {
      "color": "#300B99",
      "disable": false,
      "tools": {},
      "mode": "subagent",
      "model": "momus/gpt-5.5",
      "fallback_models": [
        "momus/glm-5.1",
        "momus/qwen3.5-plus",
        "momus/mimo-v2.5-pro",
        "momus/MiniMax-M2.7-highspeed"
      ],
      "description": "Auditor de qualidade — revisa código, identifica inconsistências, pontos de falha e violações de padrões; opera como revisor crítico."
    },
    "prometheus": {
      "color": "#90A300",
      "disable": false,
      "tools": {},
      "mode": "subagent",
      "model": "prometheus/gpt-5.5",
      "fallback_models": [
        "prometheus/glm-5.1",
        "prometheus/qwen3.5-plus",
        "prometheus/kimi-k2.6",
        "prometheus/MiniMax-M2.7-highspeed"
      ],
      "description": "Arquiteto de planejamento — estrutura planos de execução, antecipa riscos, define escopo e garante que todas as decisões sejam tomadas antes da implementação."
    },
    "explore": {
      "color": "#04B9AD",
      "disable": false,
      "tools": {},
      "mode": "subagent",
      "model": "explore/gpt-5.5",
      "fallback_models": [
        "explore/deepseek-v4-flash",
        "explore/mimo-v2.5-pro",
        "explore/MiniMax-M2.7-highspeed",
        "explore/MiniMax-M2.7-highspeed"
      ],
      "description": "Cartógrafo do código — navega pela base de código, descobre padrões, mapeia dependências e coleta contexto para embasar decisões."
    },
    "multimodal-looker": {
      "color": "#006894",
      "disable": false,
      "tools": {},
      "mode": "subagent",
      "model": "multimodal-looker/gpt-5.5",
      "fallback_models": [
        "multimodal-looker/kimi-k2.6",
        "multimodal-looker/qwen3.5-plus",
        "multimodal-looker/deepseek-v4-flash",
        "multimodal-looker/MiniMax-M2.7-highspeed"
      ],
      "description": "Intérprete visual — analisa imagens, screenshots, diagramas e artefatos visuais para extrair informações e guiar implementação."
    },
    "metis": {
      "color": "#00B356",
      "disable": false,
      "tools": {},
      "mode": "subagent",
      "model": "metis/gpt-5.5",
      "fallback_models": [
        "metis/glm-5.1",
        "metis/qwen3-coder-plus",
        "metis/mimo-v2.5-pro",
        "metis/MiniMax-M2.7-highspeed"
      ],
      "description": "Estrategista de solução — decompõe problemas complexos, valida abordagens e sugere arquiteturas antes da implementação."
    },
    "build": {
      "color": "#555555",
      "disable": false,
      "tools": {},
      "model": "build/gpt-5.5",
      "fallback_models": [
        "build/deepseek-v4-pro",
        "build/glm-5.1",
        "build/qwen3.5-plus",
        "build/MiniMax-M2.7-highspeed"
      ],
      "description": "Agente padrão — executor genérico para tarefas que não se encaixam em agentes especializados; ponto de entrada default do sistema."
    },
    "plan": {
      "color": "#2E86AB",
      "disable": false,
      "mode": "subagent",
      "model": "plan/gpt-5.5",
      "fallback_models": [
        "plan/glm-5.1",
        "plan/qwen3.5-plus",
        "plan/deepseek-v4-flash",
        "plan/MiniMax-M2.7-highspeed"
      ],
      "description": "Agente de planejamento — opera em modo exclusivo de planejamento (read-only), sem acesso a ferramentas de edição; restrito a artefatos de especificação."
    },
    "OpenCode-Builder": {
      "color": "#A23B72",
      "disable": false,
      "tools": {},
      "model": "OpenCode-Builder/gpt-5.5",
      "fallback_models": [
        "OpenCode-Builder/deepseek-v4-pro",
        "OpenCode-Builder/glm-5.1",
        "OpenCode-Builder/qwen3.5-plus",
        "OpenCode-Builder/MiniMax-M2.7-highspeed"
      ],
      "description": "Construtor do ecossistema — responsável pela manutenção, evolução e sincronização das configurações do OpenCode e seus plugins."
    }
  },
  "categories": {
    "ultrabrain": {
      "model": "ultrabrain/gpt-5.5",
      "fallback_models": [
        "ultrabrain/glm-5.1",
        "ultrabrain/qwen3.5-plus",
        "ultrabrain/kimi-k2.6",
        "ultrabrain/MiniMax-M2.7-highspeed"
      ],
      "description": "Raciocínio profundo — reservado para problemas com alta densidade lógica, algoritmos complexos e análises multifatoriais."
    },
    "deep": {
      "model": "deep/gpt-5.5",
      "fallback_models": [
        "deep/qwen3.5-plus",
        "deep/qwen3-coder-plus",
        "deep/mimo-v2.5-pro",
        "deep/MiniMax-M2.7-highspeed"
      ],
      "description": "Execução autônoma — resolve problemas orientados a objetivos com mínima supervisão; ideal para tarefas de médio a grande porte."
    },
    "code": {
      "model": "code/gpt-5.5",
      "fallback_models": [
        "code/deepseek-v4-pro",
        "code/deepseek-v4-flash",
        "code/glm-5.1",
        "code/MiniMax-M2.7-highspeed"
      ],
      "description": "Engenharia de software — implementação, refatoração, debug e tarefas técnicas gerais de código."
    },
    "artistry": {
      "model": "artistry/gpt-5.5",
      "fallback_models": [
        "artistry/deepseek-v4-pro",
        "artistry/kimi-k2.6",
        "artistry/qwen3.5-plus",
        "artistry/MiniMax-M2.7-highspeed"
      ],
      "description": "Solução criativa — aborda problemas complexos com estratégias não convencionais e pensamento divergente."
    },
    "quick": {
      "model": "quick/gpt-5.5",
      "fallback_models": [
        "quick/MiniMax-M2.7-highspeed",
        "quick/qwen3.5-plus",
        "quick/deepseek-v4-pro",
        "quick/MiniMax-M2.7-highspeed"
      ],
      "description": "Tarefas triviais — mudanças em arquivo único, correções pontuais e operações rápidas sem dependências cruzadas."
    },
    "unspecified-low": {
      "model": "unspecified-low/gpt-5.5",
      "fallback_models": [
        "unspecified-low/MiniMax-M2.7-highspeed",
        "unspecified-low/qwen3.5-plus",
        "unspecified-low/mimo-v2.5-pro",
        "unspecified-low/MiniMax-M2.7-highspeed"
      ],
      "description": "Propósito geral (baixo esforço) — tarefas que não se encaixam em outras categorias e exigem pouco tempo ou contexto."
    },
    "unspecified-high": {
      "model": "unspecified-high/gpt-5.5",
      "fallback_models": [
        "unspecified-high/deepseek-v4-pro",
        "unspecified-high/glm-5.1",
        "unspecified-high/mimo-v2.5-pro",
        "unspecified-high/MiniMax-M2.7-highspeed"
      ],
      "description": "Propósito geral (alto esforço) — tarefas que não se encaixam em outras categorias e exigem investimento significativo de contexto."
    },
    "writing": {
      "model": "writing/gpt-5.5",
      "fallback_models": [
        "writing/qwen3.5-plus",
        "writing/deepseek-v4-flash",
        "writing/kimi-k2.6",
        "writing/MiniMax-M2.7-highspeed"
      ],
      "description": "Documentação técnica — redação de docs, README, changelogs, AGENTS.md e prosa técnica em geral."
    }
  }
}
